[
  {
    "type": "Gene",
    "id": "gene_meta_children_game_session_rhythm",
    "category": "session_rhythm",
    "signals_match": [
      "session_level_pattern",
      "children_game_project",
      "multi_game_portfolio",
      "7h_plus_session",
      "50_plus_prompts"
    ],
    "preconditions": [
      "用户正在开发儿童益智游戏集合（多游戏合集项目），session时长超过5小时，prompt数超过40。",
      "项目包含多个子游戏（如推箱子、消消乐、连连看、记忆翻牌），需要跨游戏的统一功能应用。",
      "长session中呈现明显的阶段性节奏：UI打磨→游戏参数→音效→设置→关卡。"
    ],
    "strategy": [
      "识别session中的阶段边界（通常以'更新文档'标记），在阶段切换时主动确认理解用户的新目标方向。",
      "跨游戏功能应用（如音效绑定到所有游戏）时，按游戏逐个处理，避免遗漏。",
      "用户在长session后期倾向于使用更简短的指令（'build'、'更新文档'），不要要求更多上下文。",
      "关卡数据注入阶段（连续粘贴配置）应保持高效的5-6步节奏，不需要额外确认。"
    ],
    "constraints": {},
    "validation": [],
    "title_zh": "儿童游戏集合长session节奏模式",
    "title_en": "Children's Game Collection Long Session Rhythm Pattern",
    "_provenance": {
      "source": "traj-exp-accumulate",
      "project": "wzp",
      "session_hashes": ["9dc56f96"],
      "turn_range": "T01-T53",
      "prompt_indices": [],
      "evidence": "53 prompts / 7.6h session. Clear phase rhythm: visual polish (T01-T13) → game params (T14-T20) → audio pipeline (T21-T33) → settings (T34-T39) → level injection (T41-T45) → final tweaks (T46-T53). Doc checkpoints at T14/T34/T40/T50."
    }
  },
  {
    "type": "Gene",
    "id": "gene_meta_intent_distribution_fm_dominant",
    "category": "session_rhythm",
    "signals_match": [
      "session_level_pattern",
      "feature_modification_dominant",
      "fm_ratio_gt_40pct",
      "low_bug_rate",
      "low_correction_rate"
    ],
    "preconditions": [
      "session中 feature_modification 占比超过40%，且 bug_report + ai_output_correction 总计不超过10%。",
      "表明项目处于功能打磨期（产品基本可用，用户在精调参数和扩展应用范围）。",
      "Agent工作质量较高（错误步骤为0，用户纠正仅2次），用户信任度高。"
    ],
    "strategy": [
      "在功能打磨期，优先保持修改的精确性和一致性，每次只改用户提到的参数。",
      "不要在打磨期引入新的技术债或架构变更，保持代码稳定。",
      "当用户频繁修改同一区域时（如连续调整装饰物大小9次），可以在第3-4次后建议用户给出目标值范围。",
      "低bug率说明当前的 Read→Edit→Build 流程有效，保持不变。"
    ],
    "constraints": {},
    "validation": [],
    "title_zh": "Feature Modification主导的功能打磨期",
    "title_en": "Feature Modification Dominant — Product Polish Phase",
    "_provenance": {
      "source": "traj-exp-accumulate",
      "project": "wzp",
      "session_hashes": ["9dc56f96"],
      "turn_range": "T01-T53",
      "prompt_indices": [],
      "evidence": "Intent distribution: feature_modification 24/53 (45%), new_feature 15/53 (28%), bug_report 3/53 (6%), ai_output_correction 0 (but 2 is_correction=true). 0 error steps in 953 total steps."
    }
  }
]
