[
  {
    "type": "Gene",
    "id": "gene_br_persistent_failure_escalation",
    "category": "diagnostic",
    "signals_match": [
      "intent:bug_report",
      "is_correction_of_ai_work:true",
      "cn_still_not_working_keywords",
      "consecutive_same_issue",
      "urgency:high",
      "cn_only_once_keywords"
    ],
    "preconditions": [
      "用户在前一轮报告了问题且AI声称已修复，但用户在当前轮报告'还是没有效果'或'还是只能XX一次'。",
      "问题已持续2~3+轮，属于持续性故障升级场景。用户可能用略微不同的措辞重复反馈。",
      "用户的语气从描述性('看起来并没有')升级到追问式('还是没有...检查是什么问题')或简短重复('还是只能点击一次')。"
    ],
    "strategy": [
      "不要重复上一次的修复方式。先使用 Read 完整阅读相关代码，理解上一次修改为何无效。",
      "检查常见失效原因：代码被覆盖、事件未注册、函数未被调用、文件未保存、缓存未刷新。",
      "使用 Grep 搜索修改是否确实生效（在编译产物中是否存在）。",
      "找到根因后修复，build 并在 respond_to_user 中明确说明上次修复失败的原因。",
      "这是信任修复场景——解释清楚根因比单纯修复更重要。"
    ],
    "constraints": {
      "must_explain_previous_failure_cause": true,
      "must_build_after_fix": true,
      "do_not_repeat_previous_fix": true
    },
    "validation": [
      "能明确说明上次修复为何无效",
      "本次修复的代码路径与上次不同或更完整",
      "build 通过"
    ],
    "title_zh": "持续故障升级诊断（还是没效果）",
    "title_en": "Persistent Failure Escalation — Root Cause on Repeated Bug Report",
    "_provenance": {
      "source": "traj-exp-accumulate",
      "project": "wzp",
      "session_hashes": ["9dc56f96", "374e4eb7"],
      "turn_range": "9dc56f96:T09-T10, 374e4eb7:T20-T22",
      "prompt_indices": [8, 9],
      "evidence": "9dc56f96 T09-T10: 2-turn escalation on floating effect. 374e4eb7 T20-T22: 3-turn escalation on click-only-once bug ('只会显示一个'→'还是只能点击依次'→'还是只能点击一次'). Pattern confirmed: users repeat near-identical complaints with subtle wording changes.",
      "session_count": 2
    }
  },
  {
    "type": "Gene",
    "id": "gene_br_post_feature_functional_bug",
    "category": "diagnostic",
    "signals_match": [
      "intent:bug_report",
      "target:game_logic",
      "recent_new_feature_nearby",
      "ui_data_binding_issue",
      "cn_not_updating_keywords"
    ],
    "preconditions": [
      "用户刚使用新构建的功能（如设置页面），发现UI与数据不同步的问题。",
      "bug报告紧跟在 new_feature 交付之后（1-3轮内）。",
      "典型症状：滑块拖动但数值不变、进度条总是100%、显示值与实际值不一致。"
    ],
    "strategy": [
      "优先检查UI组件的数据绑定：事件回调是否正确更新显示值。",
      "检查滑块/进度条的值更新逻辑：是否在 onChange 事件中同步更新了文本显示。",
      "检查初始化流程：是否在创建UI时就设置了正确的初始值（而非硬编码默认值）。",
      "如果用户同时提出附加需求（如'主页面按钮音效也受音量影响'），一并处理。",
      "修复后在 respond_to_user 中说明具体绑定问题的位置。"
    ],
    "constraints": {
      "must_build_after_fix": true
    },
    "validation": [
      "UI操作（拖动/点击）后显示值实时更新",
      "实际逻辑值与显示值一致",
      "build 通过"
    ],
    "title_zh": "新功能交付后UI数据绑定Bug",
    "title_en": "Post-Feature UI Data Binding Bug — Display vs. Logic Mismatch",
    "_provenance": {
      "source": "traj-exp-accumulate",
      "project": "wzp",
      "session_hashes": ["9dc56f96"],
      "turn_range": "T37",
      "prompt_indices": [36],
      "evidence": "Volume slider bug immediately after settings UI feature (T36): percentage not updating, progress bar stuck at 100%. 30 steps to fix (complex data binding issue)."
    }
  },
  {
    "type": "Gene",
    "id": "gene_br_pagination_navigation_break",
    "category": "diagnostic",
    "signals_match": [
      "intent:bug_report",
      "target:game_logic",
      "page_navigation_keywords",
      "click_no_response",
      "cn_pagination_bug"
    ],
    "preconditions": [
      "用户报告在翻页/分页后点击元素无响应。",
      "问题仅出现在非首页（如第二页、第三页），首页正常。",
      "典型原因：分页切换时事件监听器未重新绑定，或元素ID/索引计算有偏移。"
    ],
    "strategy": [
      "检查分页逻辑中元素点击事件的绑定方式：是基于固定索引还是动态绑定。",
      "常见问题：翻页后元素复用但点击事件仍引用旧页的数据索引。",
      "检查关卡选择的点击回调中索引计算是否加入了页码偏移量。",
      "修复后需测试多页翻转场景（首页→二页→三页→返回首页）的点击响应。"
    ],
    "constraints": {
      "must_build_after_fix": true
    },
    "validation": [
      "翻页后点击元素可正常导航到目标",
      "首页功能不受影响",
      "多次翻页来回后仍正常"
    ],
    "title_zh": "分页导航后点击失效",
    "title_en": "Pagination Navigation Break — Click Unresponsive After Page Switch",
    "_provenance": {
      "source": "traj-exp-accumulate",
      "project": "wzp",
      "session_hashes": ["9dc56f96"],
      "turn_range": "T18",
      "prompt_indices": [17],
      "evidence": "连连看 page 2 click → no navigation. 8 steps to fix. Classic pagination index offset bug."
    }
  },
  {
    "type": "Gene",
    "id": "gene_br_touch_target_overlap",
    "category": "diagnostic",
    "signals_match": [
      "intent:bug_report",
      "target:ui_layout",
      "click_intercept_by_other_element",
      "z_order_conflict",
      "cn_cannot_click_keywords"
    ],
    "preconditions": [
      "用户报告某个按钮'无法点击'，但该按钮在UI上可见且之前可正常使用。",
      "根因是另一个可交互元素（如角色立绘、全屏触控区域）覆盖在按钮上方，拦截了点击事件。",
      "通常在新增交互功能（如点击角色聊天、全屏手势）后出现，新元素的触控范围过大。"
    ],
    "strategy": [
      "首先确认被遮挡按钮的位置和尺寸，再检查该区域上方是否有其他可交互元素。",
      "检查触控区域（hitTest/touchArea）的优先级和层级关系（z-order）。",
      "常见修复方式：缩小遮挡元素的触控范围、调整z-order、为被遮挡按钮设置更高的事件优先级。",
      "修复后验证：被遮挡按钮恢复可点击，同时遮挡元素在其应有区域仍可正常响应。",
      "此类bug通常需要2次build验证（首次修复可能只解决了一侧）。"
    ],
    "constraints": {
      "must_build_after_fix": true,
      "verify_both_elements_work": true
    },
    "validation": [
      "之前无法点击的按钮恢复正常",
      "之前遮挡的元素在其合理区域仍可交互",
      "build 通过"
    ],
    "title_zh": "触控区域重叠导致按钮失效",
    "title_en": "Touch Target Overlap — Element Click Intercepted by Overlapping Area",
    "_provenance": {
      "source": "traj-exp-accumulate",
      "project": "wzp",
      "session_hashes": ["374e4eb7"],
      "turn_range": "T14, T26",
      "prompt_indices": [13, 25],
      "evidence": "T14: 翻页按钮被角色聊天触控区拦截 (45 steps, 2 builds). T26: 换装页面设置按钮无法点击 (34 steps, 2 builds). Both caused by newly added interactive elements overlapping existing buttons."
    }
  }
]
