[
  {
    "type": "Gene",
    "id": "gene_inq_feature_status_query",
    "category": "informational",
    "signals_match": [
      "intent:inquiry",
      "target:visual_style|game_logic|ui_layout",
      "question_format",
      "cn_what_effect_keywords",
      "cn_what_value_keywords",
      "no_code_change_expected",
      "often_precedes_modification"
    ],
    "preconditions": [
      "用户以疑问句形式询问某个功能的当前状态、实现方式或效果描述。",
      "不要求代码修改，只需信息回答。",
      "可能出现在用户准备决定下一步操作之前（信息收集阶段）。"
    ],
    "strategy": [
      "使用 Read/Grep 查找相关功能的实现代码，理解当前行为。",
      "用简洁的中文描述回答用户的问题，不要主动提出修改建议（除非用户追问）。",
      "如果功能涉及动画/视觉效果，描述具体的实现参数（持续时间、缓动函数、方向等）。",
      "步骤极少（3步），不需要 build。"
    ],
    "constraints": {
      "no_edits": true,
      "no_build": true,
      "concise_answer": true
    },
    "validation": [
      "回答基于代码实际实现，非猜测",
      "未产生任何文件修改"
    ],
    "title_zh": "功能状态查询（纯信息回答）",
    "title_en": "Feature Status Query — Information-Only Response",
    "_provenance": {
      "source": "traj-exp-accumulate",
      "project": "wzp",
      "session_hashes": ["9dc56f96", "374e4eb7"],
      "turn_range": "9dc56f96:T48, 374e4eb7:T05",
      "prompt_indices": [47],
      "evidence": "9dc56f96 T48: '转场动画是什么效果' (3 steps). 374e4eb7 T05: '预览区高度是多少...页面排版是怎样的' (3 steps). Pattern: inquiry often precedes a feature_modification (T05→T06 set height to 180). Users gather info before deciding parameter values.",
      "session_count": 2
    }
  }
]
